{
  "$schema": "https://json-schema.org/draft/2020-12/schema",
  "$id": "https://nauticana.github.io/charter/schema/agent/authority_grant.schema.json",
  "title": "AuthorityGrant",
  "description": "Explicit authority scoped to actor, capability, resource scope, organizational context, and validity; absence of a grant is denial.",
  "x-charter-requirements": [
    "CHR-AUTH-001",
    "CHR-AUTH-002",
    "CHR-AUTH-003",
    "CHR-AUTH-004",
    "CHR-AUTH-011"
  ],
  "type": "object",
  "allOf": [
    {
      "$ref": "../common.schema.json#/$defs/documentBase"
    }
  ],
  "properties": {
    "charterSpecVersion": true,
    "namespace": true,
    "id": true,
    "name": true,
    "description": true,
    "lifecycleState": true,
    "validity": true,
    "extensions": true,
    "kind": {
      "const": "AuthorityGrant"
    },
    "enterpriseId": {
      "$ref": "../common.schema.json#/$defs/idRef",
      "x-charter-ref-kinds": [
        "Enterprise"
      ]
    },
    "actor": {
      "allOf": [
        {
          "$ref": "../common.schema.json#/$defs/objectRef"
        }
      ],
      "properties": {
        "kind": {
          "enum": [
            "HumanIdentity",
            "AgentIdentity"
          ]
        }
      }
    },
    "capabilityId": {
      "$ref": "../common.schema.json#/$defs/idRef",
      "x-charter-ref-kinds": [
        "CapabilityContract"
      ]
    },
    "resourceScope": {
      "type": "string",
      "minLength": 1,
      "maxLength": 500
    },
    "organizationalContext": {
      "type": "string",
      "minLength": 1,
      "maxLength": 200
    },
    "limits": {
      "type": "array",
      "items": {
        "$ref": "../common.schema.json#/$defs/limit"
      }
    },
    "delegation": {
      "type": "object",
      "properties": {
        "delegator": {
          "allOf": [
            {
              "$ref": "../common.schema.json#/$defs/objectRef"
            }
          ]
        },
        "maxRedelegationDepth": {
          "type": "integer",
          "minimum": 0,
          "description": "0 means the recipient may not delegate further."
        }
      },
      "required": [
        "delegator",
        "maxRedelegationDepth"
      ],
      "additionalProperties": false
    },
    "certification": {
      "description": "Periodic recertification; once certifiedAt plus intervalDays has passed the grant is suspended (CHR-AUTH-011).",
      "type": "object",
      "properties": {
        "intervalDays": {
          "type": "integer",
          "minimum": 1,
          "maximum": 3660
        },
        "certifiedAt": {
          "type": "string",
          "format": "date-time"
        },
        "certifiedBy": {
          "allOf": [
            {
              "$ref": "../common.schema.json#/$defs/objectRef"
            }
          ],
          "properties": {
            "kind": {
              "enum": [
                "HumanIdentity"
              ]
            }
          }
        },
        "evidenceRecordId": {
          "$ref": "../common.schema.json#/$defs/idRef",
          "x-charter-ref-kinds": [
            "EvidenceRecord"
          ],
          "description": "The human-decision record of the certification."
        }
      },
      "required": [
        "intervalDays",
        "certifiedAt",
        "certifiedBy",
        "evidenceRecordId"
      ],
      "additionalProperties": false
    }
  },
  "required": [
    "kind",
    "enterpriseId",
    "actor",
    "capabilityId",
    "resourceScope",
    "organizationalContext",
    "limits",
    "validity"
  ],
  "unevaluatedProperties": false
}
